{
  "administrator_username": "admin",
  "container_daemon_contacted": false,
  "contract_version": "leos.first-run-configuration.v1",
  "external_network_contacted": false,
  "first_run_complete": true,
  "generated_at": "2026-07-20T00:00:00+00:00",
  "installation_id": "installation-3bafc36b83beaf6f",
  "node_id": "node-example",
  "plan_id": "plan-4ae24502f43546e5",
  "runtime_profile": "local-standard-nvidia",
  "selected_profile": "leos-standard-nvidia",
  "session_id": "first-run-7a0168a004401f40"
}
